{
  "class": {
    "type": "class",
    "extends": "net.minecraft.nbt.NumericTag",
    "comment": "Represents a NBT Tag for a standard @(wint)."
  },
  "fields": {
    "SELF_SIZE_IN_BYTES": {
      "type": "int",
      "visibility": "private",
      "mods": ["static", "final"],
      "value": "12",
      "comment": "The size in bytes of a @(wint) tag."
    },
    "TYPE": {
      "type": "net.minecraft.nbt.TagType<{this}>",
      "mods": ["static", "final"],
      "comment": "The type of tag this class represents."
    },
    "ZERO": {
      "type": "{this}",
      "mods": ["static", "final"],
      "comment": "A @({this}) with a value of `0`."
    },
    "data": {
      "type": "int",
      "visibility": "private",
      "mods": ["final"],
      "comment": "The value of this tag as an int."
    }
  },
  "constructors": [
    {
      "visibility": "package",
      "params": [
        {
          "type": "int",
          "name": "data",
          "comment": "The value of this tag as an int."
        }
      ],
      "comment": "Creates a new @(wint) tag with the given value."
    }
  ],
  "methods": {
    "valueOf": [
      {
        "mods": ["static"],
        "params": [
          {
            "type": "int",
            "name": "data",
            "comment": "The value of this tag as an int."
          }
        ],
        "return": {
          "type": "{this}",
          "comment": "A new @(wint) tag with the given value."
        },
        "comment": "Returns a new @(wint) tag with the given value."
      }
    ]
  }
}