{
  "class": {
      "type": "class",
      "implements": [
        "net.minecraft.WorldVersion"
      ],
      "comment": "The default implementation of WorldVersion that automatically detects the protocl and server version."
  },
  "fields": {
    "LOGGER": {
      "type": "org.slf4j.Logger",
      "visibility": "private",
      "mods": ["static", "final"],
      "comment": "The logger for this class."
    },
    "BUILT_IN": {
      "type": "net.minecraft.WorldVersion",
      "mods": ["static", "final"],
      "comment": "The built in minecraft version."
    },
    "id": {
      "type": "string",
      "visibility": "private",
      "mods": ["final"],
      "comment": "The Unique Identifier of this Server's Version, as a trimmed UUID string."
    },
    "name": {
      "type": "string",
      "visibility": "private",
      "mods": ["final"],
      "comment": "The Friendly Name of this Server's Version, such as \"1.20.2\"."
    },
    "stable": {
      "type": "boolean",
      "visibility": "private",
      "mods": ["final"],
      "comment": "Whether or not this Server's Version is considered stable."
    },
    "worldVersion": {
      "type": "net.minecraft.WorldVersion",
      "visibility": "private",
      "mods": ["final"],
      "comment": "The WorldVersion of this Server's Version."
    },
    "protocolVersion": {
      "type": "int",
      "visibility": "private",
      "mods": ["final"],
      "comment": "The Protocol Version of this Server's Version."
    },
    "resourcePackVersion": {
      "type": "int",
      "visibility": "private",
      "mods": ["final"],
      "comment": "The Resource Pack Version ID of this Server's Version."
    },
    "dataPackVersion": {
      "type": "int",
      "visibility": "private",
      "mods": ["final"],
      "comment": "The Data Pack Version ID of this Server's Version."
    },
    "buildTime": {
      "type": "date",
      "visibility": "private",
      "mods": ["final"],
      "comment": "The Build Time of this Server's Version."
    }
  },
  "constructors": [
    {
      "visibility": "private",
      "comment": "Constructs a new DetectedVersion using hard-coded parameters."
    },
    {
      "visibility": "private",
      "params": [
        {
          "type": "com.google.gson.JsonObject",
          "name": "json",
          "comment": "The JSON Object to read from."
        }
      ],
      "comment": "Constructs a new DetectedVersion using the given JSON Object. The inputted object is directly read from <code>version.json</code>, a file stored in the server JAR."
    }
  ],
  "methods": {
    "tryDetectVersion": {
      "mods": ["static"],
      "return": {
        "type": "net.minecraft.WorldVersion",
        "comment": "The detected version, or the built-in version if the version cannot be detected."
      },
      "comment": "Attempts to detect the version of the server. If the version cannot be detected, the built-in version is returned."
    }
  }
}